{
  "schemaVersion": 1,
  "repository": "team/orchard",
  "summary": "A task API Analyzed 4 selected files at commit 1234567. This is an evidence-backed code tour, not a verified execution trace.",
  "commitSha": "1234567890abcdef1234567890abcdef12345678",
  "branch": "feature/main",
  "fileCount": 4,
  "analysisKind": "static",
  "analysisVersion": "static-v2",
  "model": null,
  "generatedAt": null,
  "technologies": ["JavaScript", "express", "pg"],
  "warnings": [
    "Static code tour: roles are inferred from filenames and content. Import links are not proof of runtime data flow. No LLM is used.",
    "Read 4 selected files out of 4 tree entries. Files over 40 KB, generated files, and lockfiles are excluded."
  ],
  "files": [
    {
      "path": "README.md",
      "content": "# Orchard\n\nA small task API."
    },
    {
      "path": "package.json",
      "content": "{\"dependencies\":{\"express\":\"^5.0.0\",\"pg\":\"^8.0.0\"}}"
    },
    {
      "path": "src/index.js",
      "content": "const service = require('./service');\nservice.run();"
    },
    {
      "path": "src/service.js",
      "content": "exports.run = () => 'ok';"
    }
  ],
  "nodes": [
    {
      "id": "overview",
      "label": "Repository overview",
      "kind": "GITHUB METADATA",
      "description": "A task API",
      "files": []
    },
    {
      "id": "README.md",
      "label": "README.md",
      "kind": "DOCUMENTATION",
      "description": "The project’s own documentation. Read the source excerpt for setup, usage, and the author’s description.",
      "files": ["README.md"]
    },
    {
      "id": "package.json",
      "label": "package.json",
      "kind": "DEPENDENCY MANIFEST",
      "description": "Declares project configuration and dependencies. A dependency declaration does not prove that it is used at runtime.",
      "files": ["package.json"]
    },
    {
      "id": "src/index.js",
      "label": "index.js",
      "kind": "SOURCE · INFERRED ROLE",
      "description": "Its filename suggests an entry point or module export. Inspect its imports and initialization code to confirm its responsibility.",
      "files": ["src/index.js"]
    },
    {
      "id": "src/service.js",
      "label": "service.js",
      "kind": "SOURCE · INFERRED ROLE",
      "description": "A source file selected from the repository. Inspect its implementation and observed imports to understand its responsibility.",
      "files": ["src/service.js"]
    }
  ],
  "edges": [
    {
      "from": "src/index.js",
      "to": "src/service.js",
      "kind": "imports"
    }
  ],
  "steps": [
    {
      "title": "Repository overview",
      "body": "A task API",
      "nodeId": "overview",
      "evidence": []
    },
    {
      "title": "README.md",
      "body": "The project’s own documentation. Read the source excerpt for setup, usage, and the author’s description.",
      "nodeId": "README.md",
      "evidence": []
    },
    {
      "title": "package.json",
      "body": "Declares project configuration and dependencies. A dependency declaration does not prove that it is used at runtime.",
      "nodeId": "package.json",
      "evidence": []
    },
    {
      "title": "index.js",
      "body": "Its filename suggests an entry point or module export. Inspect its imports and initialization code to confirm its responsibility.",
      "nodeId": "src/index.js",
      "evidence": []
    },
    {
      "title": "service.js",
      "body": "A source file selected from the repository. Inspect its implementation and observed imports to understand its responsibility.",
      "nodeId": "src/service.js",
      "evidence": []
    }
  ]
}
